start time,title,artist,duration,program id
2021-07-07T00:02:41-05:00,Good Lord Pays Me,Meagan Tubb & Shady People,193,8428
2021-07-07T00:06:01-05:00,No One Like You,Scorpions,229,1304
2021-07-07T00:09:56-05:00,Beast Of Burden,Rolling Stones,198,1219
2021-07-07T00:13:14-05:00,The Spirit Of Radio,Rush,295,2962
2021-07-07T00:22:17-05:00,Waitin' For The Bus / Jesus Just Left Chica,ZZ Top,372,1727
2021-07-07T00:28:30-05:00,Bound For The Floor,Local H,222,2052
2021-07-07T00:32:18-05:00,Sweet Child O' Mine (LP Version),Guns N' Roses,348,2988
